id,created_utc,subreddit,parent_id,author,body,score,type,matched_keywords,title,selftext,num_comments,url
mu07r9o,2025-05-24 22:29:43,tires,t1_mtw4k9f,All_Debt_Shackles_US,"Kind of you to do, but by including a mixture of tires from different cars and with different tread wears, you are confusing everybody.  Most people don’t read every thread in the conversation before they give their opinion. And if they do read it, they don’t remember it by the time they start typing.

When you have to explain the pictures to multiple posters, you’ve confused the matter. 

As a suggestion, next time maybe edit the pictures and use words to explain them.  Or update your initial post with some kind of an explanation; although that’s not necessarily going to be successful either.",1,comment,2,,,,
1kuk9ve,2025-05-25 04:53:44,tires,,Killzzzs6,,2,,2,Do I need a new tire?,"Am I cooked? Wife curbed the rim making a right turn and upon further inspection, I realized that there was slight damage to the tire sidewall.
",4.0,https://www.reddit.com/gallery/1kuk9ve
1kuomrj,2025-05-25 08:20:27,tires,,Flashy_Ad_8247,,0,,2,Is 255 width tire ok for a 18x8j,Also what’s the highest possible tire width I can run within the safe limits of course,5.0,https://www.reddit.com/r/tires/comments/1kuomrj/is_255_width_tire_ok_for_a_18x8j/
1ktvpv9,2025-05-24 06:55:36,tires,,im_not_a_bot_hehe,,106,,2,"Nail in the Tire, shop suggested leaving it. Is it safe?","I saw this nail while I was putting something in the backseat this morning. No idea when it actually got there. As per the tire pressure from tmps, there's no leak. It has been 36 psi like the other 3 tires. 

I went to a tire shop immediately and they just glanced at it and said if they takes it out and it leaks I'd have to replace the tire. He suggested leaving it in as it didn't seem to be leaking.

I went to another tire shop on my way home. They lifted the car, sprayed some water and said there's an extremely minor leak. He suggested replacing the tire but said if you don't want to right now just keep filling air if it's losing pressure slowly.

Between the time I noticed the nail and driving to the tire shops and coming home, I have driven more than 50 miles and the pressure is still intact. 

Is there a risk of blowout or an accident? It's a Yokohama yk740 gtx running at about 40k miles with a tread depth of 6. As it's an AWD, I'd have to replace all 4 tires.

Asking for advice here as it's my first car and I do not have experience with it. I had to replace all 4 tires at 4k miles due to a nail but as I was out of state on a trip I didn't have time to ask anyone or research anything.

Thanks. ",135.0,https://www.reddit.com/gallery/1ktvpv9
mu5328l,2025-05-25 17:27:26,tires,t3_1ktvpv9,184Banjo,"look for a similar size used tire with the same amount of tread wear, you might get lucky. otherwise replace 4",2,comment,2,,,,
mtz3dh4,2025-05-24 16:42:36,tires,t3_1ktvpv9,_shavo_,"If you want to replace tire I would recommend getting replacing two now and put those in the front, and then replacing the other two at the time needed and make a rotation, you are always gonna get different tire wear in the front and the back, so don’t be to worry about having to change al tire at the same time, most of the time you are gonna change two and then the other two.

If you got the possibility of changing all tires now is perfect but not completely necessary",1,comment,2,,,,
mu3misr,2025-05-25 10:11:51,tires,t3_1ktvpv9,Warm_Feeling_5363,"Thanks for sharing all the details. You're doing the right thing by checking and getting second opinions. Here are a few things to keep in mind.

Even if the nail isn't causing a leak right now, there is still a risk, especially if it’s deep enough to reach the inner layers of the tire. Here's what could happen.

The heat and vibration while driving can cause the nail to gradually work deeper into the tire. As it shifts or gets hotter from road friction, it may eventually pierce the inner liner and create a slow or sudden air leak. If the puncture deepens suddenly at high speed, the result can be a rapid loss of pressure and that can lead to a blowout, especially on a highway. Even a very slow leak will leave you constantly monitoring tire pressure, and if it gets low unnoticed, handling, braking, and safety all suffer.

Since you're running Yokohama YK740 GTX tires at 40k miles with 6/32"" tread left, you’re near the wear point where traction starts to degrade, especially in wet weather. The fact that it's AWD complicates things, as a single replacement means matching all 4 tires to avoid drivetrain damage.

Short-term advice: If you're absolutely not replacing the tire now, monitor pressure daily. Fill it up if needed and avoid long or high-speed trips. If the leak worsens, patching from the inside might be possible, but that depends on the location of the nail. If it’s too close to the sidewall or shoulder, shops won't repair it. Don’t pull the nail out unless you're at a shop ready to plug or replace.

As a middle-ground solution, check eBay or tire resellers for a used or lightly worn Yokohama YK740 GTX with similar tread depth. Sometimes you can find one matching tire for $80–$150, which could save you from replacing the full set.

Long-term recommendation: If repair isn’t possible and no matching tire is available, consider replacing the full set with a more affordable option. It’s better than risking a blowout or damaging the AWD system over time.",1,comment,2,,,,
mtxg1rn,2025-05-24 09:10:39,tires,t3_1ktvpv9,Yoihioy,You could leave it for a while ( I wouldn't ) until the tire wears to bald.  Or just get a plug kit ( I would)  either way not that serious.,0,comment,2,,,,
mu8fo5c,2025-05-26 05:50:17,tires,t1_mtwy46v,Sufficient-Piano-797,"You can have a shadetree plug that. If you’re gonna send it that would be what I would do rather than keeping the nail in the tire.

Also, you got taken at 4k miles. You didn’t have enough wear that a new tire would have been out of spec with the 3 others.

The issue you have to look out for is having more than 1/32 difference between any tires. That will make the tires rotate at different speeds which causes the differentials (what ensures all 4 tires rotate at the same speed and get appropriate power delivery) in the powertrain to get over-worked. ",3,comment,2,,,,
murb3i7,2025-05-29 04:56:14,tires,t1_mu3naqf,Happy_Hippo48,That's only true if there is a difference in tread wear between the new and old tires. There typically is but not always.,1,comment,2,,,,
mu4q3qk,2025-05-25 15:17:59,tires,t1_mtxjhaq,Difficult_Chicken_20,"It might have damaged the metal mesh which will affect the integrity of the tyre regardless. 

Either replace all four or just buy the one but have the shop shave down the new one to match the wear of the other three if your tyres was relatively new.",1,comment,2,,,,
mu7hko5,2025-05-26 02:51:23,tires,t1_mu7g8d6,ReversEclipse1018,"AWD. With AWD, all of the tires will wear relatively evenly, but if you have one new and 3 half life, then the other 3 will get chopped up and wear extremely unevenly.",1,comment,2,,,,
1kuniko,2025-05-25 07:25:28,tires,,mellenhater,,1,,2,Next step for goofball tire removal?,"Pesky lawn mower tire. Prybar and WD-40 weren't CUTTING it, so I had to make a smooth brain choice to feel like I was making progress. 

What's the step in operation here? 🤣",7.0,https://i.redd.it/cgmbphep2t2f1.jpeg
1kumw58,2025-05-25 06:55:32,tires,,Affordable_Mac,,1,,2,Shopping for 225/60r18,"Hi! This is my first time buying a full set of new tires, as in the past I've just replaced tires individually as I've needed them. I drive a 2013 Honda Crosstour on stock wheels, and I'm looking for 225/60R18s.
At this size the options are slimmer than I would have imagined, but so far I'm liking the looks of the Goodyear Assurance ComfortDrives, the BFG Advantage Controls, and the Michelin CrossClimates.
I value noise above all, followed by ride quality and longevity. Any help or anecdotes would be greatly appreciated, but I'm planning on going to either Sam's Club or Discount Tire some time this week, depending on what deal I can find. Thanks!",2.0,https://www.reddit.com/r/tires/comments/1kumw58/shopping_for_22560r18/
mu39x7w,2025-05-25 08:50:12,tires,t3_1kumw58,Odd-Organization2317,"Hello hello! I work at discount tire. But I’ve worked at Les Schwab and other mechanic shops. Up front to be honest, it would be best to go in and get a consultation. There is this really cool system we have called Treadwell and it can help visualize certain elements. For example, it will display road noise, how it handle in the rain and snow and so on and so forth. If price isn’t an issue and you live in an area with rain, snow and general bad winters, I would recommend the cross climate 2. They are very quiet, we usually put them on teslas. They handle amazing in the snow and rain, and they are estimated for about 50k miles. They are a solid tire, but if you live somewhere with little rain, I wouldn’t recommend them. They are mainly used for bad weather conditions. Something else that’s pretty cool is you can play around with the size of your tire and slightly alter the size. Honda ( and all car companies for what it’s worth) send us tire fitment guides, so different but close sizes that will fit with no issue. That’s a slightly uncommon size but you can change it up like for example staying with a 18 inch rim but making it a 235/55/18. I don’t know if you already know this but the first number is the width, the second number is the height, the last number is the wheel size. Changing the size is very slight and basically unnoticeable, we are talking millimeters. I hope this helped! I’d be happy to help out any other way I can, some info to best gave me help you narrow down to a specific tire would be. General price range, what state you live in, and how much driving you do are you on road trips, long work commute or is it a grocery grabber just around town. Sorry for the long message, I just love tires 😂",1,comment,2,,,,
mu3h14s,2025-05-25 09:36:24,tires,t3_1kumw58,Useful-account1,The Goodyears will be best for noise and ride comfort. The BFG will probably last longer. The crossclimate is significantly better in winter conditions since it is an all-weather tire not all-season.,1,comment,2,,,,
1kurv5i,2025-05-25 11:17:29,tires,,ExtentSad6512,,0,,2,ARE THESE TIRES SAFE SPRING/SUMMER,"Here are some images of my tires. Some are a front tire and the others are a back tire. The one where the coin goes deeper is the back tire. I gotta drive tomorrow. Is highway safe? Anyone know a max speed to travel consistantly for is? I'm not driving much just like 15-20 min max both ways on the highway for not long.

# 

",9.0,https://www.reddit.com/gallery/1kurv5i
1kujwrc,2025-05-25 04:36:22,tires,,Ok_Caterpillar8197,,1,,2,New tires?,Soo my tires are 15 years old. I know that they need to be replaced because of the age. Right now my driving consists of going around 7 miles to and from work each day. My car is also from 2005. My question is do I put more money into buying new tires or should I purchase used tires because of the age of my car? These are my current tires right now. Are they that bad? lol ,3.0,https://www.reddit.com/gallery/1kujwrc
1kue1vr,2025-05-25 00:19:43,tires,,Imark182,,2,,2,Needing a new tire...,"Is fixGo legit? I dont wanna spend much for new tires since im planning to sell the car im using in a few months.. saw this fixgo site selling it cheap, have any of yall tried it?",9.0,https://www.reddit.com/r/tires/comments/1kue1vr/needing_a_new_tire/
1kugfnp,2025-05-25 02:03:05,tires,,InternationalTree226,,0,,2,What would cause this,What would cause tire wear like this? Tire looks like this inside and outside on both driver and passenger side. ,4.0,https://i.redd.it/dhlt6ki1hr2f1.jpeg
mu2v28m,2025-05-25 07:17:08,tires,t3_1kug6s0,Odd-Organization2317,"Discount tires rule is they cannot legally put it into service if it is at 2/32 or less. They should have showed you a “know your numbers” board and explained it to you. I hope they did. Main chains IE discount tire, Les schwab ECT won’t repair or rotate tires if they are at 2/32 or less, that’s the legal wear limit.",1,comment,2,,,,
1kufg75,2025-05-25 01:20:43,tires,,Relative_Classroom95,,0,,3,Is this normal wear for a 22” tire with 10K miles?,"Found some 22”s with rims, but they have around 10K miles. Is this normal wear? ",1.0,https://www.reddit.com/gallery/1kufg75
1ku9fm8,2025-05-24 20:29:32,tires,,PureRace6750,,2,,2,Car Tire tear on side wall,My back tire hit on curb and I have a small damage on the side wall as shown in the photo. Do I need to change the tire or is it ok to drive with it. Please advise. Thanks ,4.0,https://i.redd.it/qbwysqnotp2f1.jpeg
mu0b9bl,2025-05-24 22:50:31,tires,t3_1kubxb4,biggranny000,"Should be ok, just keep an eye on it. Usually the rubber around the bead and sidewall is pretty thick. There is a chance internally that the tire is damaged (like the belts) but again if you don't notice swelling or strange wear should be fine. 

A shop can also fix curb wheels",1,comment,2,,,,
1kub34o,2025-05-24 22:02:14,tires,,PizzaSalamino,,1,,3,Tire recommendation,"Hi all,
I will soon have to change my tires on my Seat Leon mk3 ST (station wagon, 1300kg). I’m looking for all seasons 3PMS. Size 205/55 R16 91V. I live where summer reaches 35C and winter -5C and work in the alps, so colder winters. I care most about wet performance (aquaplaning and braking), fuel efficiency, but also about dry braking and noise (in order of importance). Snow or ice performance is low importance because all roads i use get salt put on them, so i would rarely ever encounter icy or roads with a lot of snow.
I was thinking of waiting for the CrossClimate 3s that will come out in july, but i’m not sure. 
What do you think? Let me know if i missed some bits of info that are needed.
Thank you all",2.0,https://www.reddit.com/r/tires/comments/1kub34o/tire_recommendation/
1ku2rtg,2025-05-24 13:02:51,tires,,UnhappyGuess4362,,5,,2,Cause????,My back right tire popped while I was heading home from work. This month also my back left tire popped but the wear didn’t look the same. Can anybody explain what is going on here and why this tire looks like this I do feel vibration when I’m driving down the road and I’m wondering if anybody knows the cause? I’m on the road everyday for work so I need to get this fixed asap thanks. ,16.0,https://www.reddit.com/gallery/1ku2rtg
mtyilph,2025-05-24 13:30:02,tires,t3_1ku2rtg,Kfuller_85,The one sided wear looks like a suspension issue also in the picture with the wheel removed on the left side looks like that bendy rod is disconnected? Tire tech not a mechanic lol when I see stuff like that I get the mechanic over to diagnose. Stabilizer link I think but not 100% definitely the wear looks like the wheel is angled a certain way and all those suspension parts in tandem keep the wheel straight in all different ways. Hope that makes sense and helps!,3,comment,2,,,,
mtygf0w,2025-05-24 13:12:45,tires,t3_1ku2rtg,Otaliema,"That was a faulty tire. The tread belting separated or shifted in the tire at that location causing a bulge that took all the wear on that rotation and because it wasn’t a smooth circle it hit harder causing it to wear really fast. Go back to the place you bought them at and they should be able to work with you in there most manufacturers have some kind of warranty vs defects. 
After you get new tires have an alignment check down and suspension check as well that much bouncing might have knocked something out of wack.",2,comment,2,,,,
mu4uh4w,2025-05-25 16:00:58,tires,t3_1ku2rtg,brickedupbuilds,Camber wear + worn out shocks or separated inner tire casing,1,comment,2,,,,
1kuabpv,2025-05-24 21:20:56,tires,,King_J__,,1,,2,Lawn mower tire help needed,"Small front tire off the wheel. Tried tying a rope around tire then twisting it tight with a screwdriver to flatten it, but it wouldn’t take air with it as flat as I could get it. Any ideas?",7.0,https://www.reddit.com/gallery/1kuabpv
1ktr8lf,2025-05-24 03:44:06,tires,,AdOverall7216,,15,,2,Wear indicators,Just saw this in another group. Why isn't this the standard for checking when it's time to replace your tires?,5.0,https://i.redd.it/yaaf8516uk2f1.jpeg
mtvvvca,2025-05-24 04:03:04,tires,t3_1ktr8lf,Ilikejdmcars,Because not all tires will wear evenly,3,comment,2,,,,
mtzlx6i,2025-05-24 19:50:50,tires,t3_1ktr8lf,OrganizedFit61,"It's simple but quite clever really, and yes tyres don't always wear evenly across the surface for all sorts of reasons. But on a decent car it's a great thing to have.",1,comment,2,,,,
mtwxzs9,2025-05-24 07:23:13,tires,t1_mtvswiu,ExactTour5340,"Continental has a *similar* feature on some tires. The letters of “DWS” wear down when it’s no longer considered safe for that environment. Dry, wet, snow, so snow (S) goes first etc etc",3,comment,2,,,,
mu9pwdl,2025-05-26 10:27:22,tires,t3_1ktx7va,Live_Mountain_7693,"Tire production is late 2021 & if normally parked in the streets, has already shown age cracks everywhere. Typically tires that are exposed to ozone gases outside or next to interior gas heaters, have shorter 4 to 5 years life spans \[Regardless of tread life remaining.\]This is a concern for it's even more important than simple tread depth. As the tire ages, the rubber begans to get less compliant and physically harder resulting in less traction, more road noise transmission and a harsher ride. You can still drive these around with them but are at a point where you should start keeping an eye out for your local tire sale replacement deal (Rather than typically waiting until the tire suddenly blows out or comes apart un-expediently at the worse time, whereas you will have a much more limited \[Most likely non-sale prices.\]choices to select from.).

PS# Keep truck's bed empty or as light as possible, to reduce stresses on tire casings \[Where cracks are forming.\].",1,comment,2,,,,
1ku2pj8,2025-05-24 12:59:31,tires,,UnhappyGuess4362,,0,,2,Cause????,My back right tire popped while I was heading home from work. This month also my back left tire popped but the wear didn’t look the same. Can anybody explain what is going on here and why this tire looks like this I do feel vibration when I’m driving down the road and I’m wondering if anybody knows the cause? I’m on the road everyday for work so I need to get this fixed asap thanks. ,6.0,https://www.reddit.com/gallery/1ku2pj8
mtzx23n,2025-05-24 21:20:07,tires,t3_1ku2pj8,ADayCareReject,"The tire in the picture seems to have severe uneven wear. It's possible the tire had a defect or was an old tire that started to come apart; but, much more likely the car has an alignment or suspension component issue - especially if both rear tires had unusual circumstances like this... 

Without more information and/or a physical inspection we'll be guessing as to the potential causes.",1,comment,2,,,,
mtt6mod,2025-05-23 19:20:15,tires,t3_1ktfuqt,acejavelin69,"18 years old, dry rotted, and right at the wear bars... They are safe to drive to the tire shop to get new tires... If you have to drive back and forth and work for a few days or a week, probably be fine. But that's about it, and every mile you drive them is a gamble and one of the times you'll lose that bet.",17,comment,2,,,,
mtt8oz1,2025-05-23 19:38:30,tires,t3_1ktfuqt,Fluffy-Awareness8286,"I don't wanna make you feel some kind of way, but my common sense says: Absolutely NOT!

1. You are at the bump defining the tire wear.

2. It/ they are way to cracked to trust them, especially on the highway.",1,comment,2,,,,
1ktscsz,2025-05-24 04:30:27,tires,,Good_Blackberry_1832,,3,,2,Are these tyres safe?,"Hi. I bought this car a few weeks ago. A 2019 car with a recent MOT. Noticed these chips occuring on multiple sidewalls today. It was accompanied by a loss of pressure dash light that came up last week. The pressure, when I checked, was slightly too high if anything.

Booked it in to be seen at the garage I bought it from. They said “it’ll be ok because the chords aren’t showing”.

Should I avoid driving until then?

Any clues as to the cause? Worn tyres? Over-inflation? Weather? It might even be vandalism.",3.0,https://www.reddit.com/gallery/1ktscsz
mtwpu4y,2025-05-24 06:37:02,tires,t3_1ktlob0,TheoryAccomplished60,"If you really want a good tire dont think about money and buy michelin pilot sport ,if you want to buy a price-performance tire buy kumho or hankook, they are good tires ,stay away from chinese tires,you can read reviews of the tires from tyrereviews.com",2,comment,2,,,,
mtutntr,2025-05-24 00:59:29,tires,t3_1ktlob0,Ancient-Way-6520,"I have the runflat version that P7 on one of my cars.  It's a great tire, has a lot of grip in the rain and it's pretty quiet for a runflat, so I imagine the non-runflat will be even better.  Seems to be wearing well",1,comment,2,,,,
mu0youj,2025-05-25 00:55:56,tires,t1_mu0leao,Ancient-Way-6520,"Idk there new tires are all among the best in their class according to testing from tire rack and tyre reviews, the PZ5, Pzero AS plus 3, P7 AS plus 3, Weatheractives",1,comment,2,,,,
1ksyxhc,2025-05-23 04:02:19,tires,,Ekim7878,,230,,2,Are these tires undrivable?,"I recently rented a Porsche Cayman from turo when I returned it the owner claimed that the tires were damaged and completely unusable they filed a claim for damaged tires I spoke with the appraiser and they said this tire condition is unacceptable and should not be on the road. What do you guys think?

I drove the car 120 miles, did no burnouts, and they did not provide tire before pictures but Turo sided with the appraiser. ",98.0,https://www.reddit.com/gallery/1ksyxhc
mtpnngx,2025-05-23 04:49:57,tires,t3_1ksyxhc,wilmayo,"If the tires are less than 5-6 years old, you have some life left in them. The tread wear bars are not showing, So, you likely have a few thousand miles left with proper care.",2,comment,2,,,,
mttyqgn,2025-05-23 22:28:58,tires,t3_1ksyxhc,Longjumping-Worry418,It's the front tire and the way that it is wearing I'm going to say the alignment is bad probably from a bad part / replaced with no alignment or someone hit a hell of a pot hole.,1,comment,2,,,,
mtrtcvv,2025-05-23 12:05:42,tires,t3_1ksyxhc,Ok_Tackle_1320,"I WOULD NOT RISK YOUR SAFETY IF YOU’VE BEEN ADVISED TWICE NOW THAT THE TIRES NEED REPLACING - THEN REP.LACE THEM NOW - SOONER RATHER THAN LATER‼️👍 Good tyres are crucial for vehicle safety, performance, and fuel efficiency. They provide grip and traction, allowing for better control, especially in adverse weather. Well-maintained tyres also contribute to reduced rolling resistance, improving fuel consumption. 
Here's why good tyres are essential:
Safety:
Tyres are the only point of contact between your vehicle and the road. They provide grip and traction, which are critical for maintaining control, especially in wet or slippery conditions. Worn or underinflated tyres can lead to reduced traction, increasing the risk of skidding or sliding. 
Performance:
Good tyres enhance handling, cornering, and braking capabilities. They help to translate your steering and acceleration actions into actual road contact. 
Fuel Efficiency:
Properly inflated tyres with adequate tread depth reduce rolling resistance, meaning the engine doesn't have to work as hard to propel the vehicle, resulting in lower fuel consumption. 
Comfort:
Tyres also contribute to a smoother and more comfortable ride by absorbing road shocks and vibrations. 
Durability:
Quality tyres are designed to withstand the rigors of regular driving and provide longer-lasting performance. 
Weather Conditions:
The right tyres can make a significant difference in handling various weather conditions, such as rain, snow, or ice. JUST A FEW HUNDRED DOLLARS WILL PROVIDE YOU WITH PEACE OF MIND FOR NEXT FEW YEARS‼️👍🙏",-4,comment,2,,,,
mu5q8zj,2025-05-25 21:05:56,tires,t1_mtpgyfw,Mortenubby,"Someone tracked this car, or did burnouts. You would have heard the noise from the tires. This kind of marbling is pretty loud.

That said, it'll wear off and be fine. The tire isn't damaged, but definitely worn more than allowed for a short rental period.",1,comment,3,,,,
mul2yx5,2025-05-28 06:02:39,tires,t1_mukadrd,BLDLED,"33 years of auto racing experience in many disciplines mean I have see this condition many times. 
After you spend a few hours with a vibratory tool shaving it off of tires you get to the point of being able to identify it.

And to be clear, I am not saying there is t other damage, it’s just the only thing that appears to be cause for any sort of concern, everything else is just tire wear.",1,comment,2,,,,
mtxxm9s,2025-05-24 11:02:19,tires,t3_1ktthmu,amazon22222,"You should learn about the different tire types, specifically ultra high performance tires vs touring/grand touring tires. The OEM tires are touring tires and you purchased ultra high performance tires. Your new tires will ridge harsher and wear faster. More importantly, they are made by conti for discount tire and there are not real testing or comparisons. Depending on the weather you drive in and the comfort/longevity/performance you want, there were much better choices. Here is an example of a touring/grand touring tire test. Real objective bench marks.

Tirerack has other videos on ultra high performance tires as well. 

[https://www.reddit.com/r/tires/comments/1h0tk7c/tire\_rack\_touring\_tire\_tests\_weatherready\_2\_and/](https://www.reddit.com/r/tires/comments/1h0tk7c/tire_rack_touring_tire_tests_weatherready_2_and/)",-1,comment,2,,,,
