id,created_utc,subreddit,parent_id,author,body,score,type,matched_keywords,title,selftext,num_comments,url
muse5pq,2025-05-29 08:12:14,tires,t3_1kxvdez,Icy_Fault3547,"You will need to have them provide actual measurements of the tread depth. 

Manufacturer warranty will have a specific definition of what Irregular wear is. It’s usually a difference of 2/32nd’s across the same tire. ie. 5/32” in the middle and 3/32” on the edge. 

If they cannot provide an actual metric to go off of they have no basis to deny the warranty. 

They look decent to me I wouldn’t say you need to replace them at all.",59,comment,2,,,,
musfn21,2025-05-29 08:20:24,tires,t3_1kxvdez,g2gfmx,"Looks like you are already on the wear bars on the side of the tire, not much life left. Underinflated tires most likely",17,comment,2,,,,
mutppp7,2025-05-29 12:53:13,tires,t3_1kxvdez,TheKevenishere,Since pennies are not money anymore why not save one and use it to measure the tread depth if the tread is below Lincoln's head then it's a bad tire? Those wear bars still have some life in them so you're fine.,2,comment,2,,,,
muwfnen,2025-05-30 00:37:53,tires,t3_1kxvdez,MalignantLugnut,"They are, the tread is worn down almost to the wear indicators (The rectangular blocks between the rows of tire treads.) You're at almost 1/8th of an inch of tread, which is more of a traction placebo.",2,comment,2,,,,
mutlw21,2025-05-29 12:26:52,tires,t3_1kxvdez,female-dreams,The wear appears even from side to side. No uneven wear. But the tire is  close to requiring replacement . Look at what's call the wear bar and how close it is to the top of the tire. When its flush the tires standard life is done,1,comment,2,,,,
muu5b3g,2025-05-29 14:58:10,tires,t3_1kxvdez,StaticCarabou27,"Well, they are not horrible. The wear bars are starting to get close but that shouldn't be an issue for a little while longer. My question is, have you been rotating your tires every 7500 miles like it says to do under your warranty. If you have been and can provide all the paper work then yes. They should warranty those tires for you. The tires aren't bad though. Should last you a little longer. Also alignment shouldn't be much of an issue at all. You look pretty evenly worn. 
Edit: just read that you do your own rotation. Walmart offers free rotation and balances after you buy your tires there. Doing your own rotations will always void your warranty at Walmart.",1,comment,2,,,,
muu7xb7,2025-05-29 15:22:07,tires,t3_1kxvdez,1130Goddamn,"There is a wear bar between the tread… the wear bar looks like it is level with the tread, this is a reasonable statement and recommendation by a tire technician, these tires will no longer provide the traction they had when they were first new. Please replace and stays safe. This is not an up-sell, this is complete honesty, if you are still in doubt, DM me and I will explain further, again, no up sell, simply concern for safety, the reason I say they will not provide the traction they had before is because the tread is the key component when it comes to ensuring you do not slide in rain. Sorry for the over- explanation.",1,comment,2,,,,
muuyyb7,2025-05-29 19:38:42,tires,t3_1kxvdez,Royal-Yogurtcloset57,"I wouldn't call them bad, but they are nearing the end of their useful life. Low thread depth is dangerous in standing water as it can lead to hydroplaning. 

You should consider changing then in the next months ( maybe at the end of the summer/ autumn).

Can't be certain, but judging from the photos, they don't have dry rot or any visible cracks so they are ok. 2.5 year old tires are not ""old"". 

BTW, that tire warranty is a bunch of baloney. To get to 65k miles you have to be driving exclusively on the highway with constant fairly low speed at moderate temperatures. High speed, high heat, mixed or urban driving lead to higher tire wear and 65k miles is a LOT of distance to cover on a single set of tires. Usually this would mean the tires suck and have low grip but high wear resistance. In any way I wouldn't buy such tires.",1,comment,2,,,,
muvad8g,2025-05-29 21:01:53,tires,t3_1kxvdez,qchrystena,"Hasn't reached the wear bars yet. Those bars are 2/32"". Judging from the picture alone, they're about 4/32 or 5/32"". It's in the area of you should consider replacing them soon as they're no longer good in the snow and will get worse in the rain from here on out. Mileage is not a good indicator and you shouldn't live by tire mileage warranty. You can still get prorated for a new set tho if you insist to the rep. The amount of miles you get off a tire greatly depends on how it's driven and kept aired up. Personally if that was me I'd get 55k out of those tires out of the 65k, I don't floor it off a red light, I don't brake like a madman either. Love your tires/car and it'll reward you. You wouldn't run a mile straight outta bed in the morning right? Why expect your car to get to 40mph in 5 seconds right out of the red light? You might get to 40k before it hits 2/32"". Getting 40k when the tread is rated for 65k means you're an aggressive driver. Every tire has a different warranty so it may or may not be worth it to go through it. They like to put age and mileage restrictions and all that bs. An absolute legend of a driver would get 60k out of tires rated at 65k by the time it's get to 2/32"". Replace at 2/32 when it's mostly dry or if you leave braking distance for rain, 3/32"" when it rains a lot where you are, and 5/32 in snow.",1,comment,2,,,,
muwcr6s,2025-05-30 00:24:21,tires,t3_1kxvdez,Delicious-Ad-1246,"They are almost down to the wear bars, it should have been a recommendation of replace soon not old and bad. The bars are indicators to when to replace your tires",1,comment,2,,,,
mux7c2n,2025-05-30 02:46:18,tires,t3_1kxvdez,fred420170,When were the tires manufactured?  They need to be replaced every 5 years regardless of tread wear.  Tires dry rot.,1,comment,2,,,,
muxw5ky,2025-05-30 04:44:11,tires,t3_1kxvdez,Curiouslyseeking2,"I’ve bought used tires to drive on a few months that was near that wear, I tell my best friend all the time to stop letting them work on his rides. He just had to replace all lug nuts bc of them & they refused to touch it bc of the lugs they screwed up",1,comment,2,,,,
musqwh1,2025-05-29 09:24:19,tires,t3_1kxvdez,Krazybob613,"They have reached the MayPop stage in tire life, they may be still legal but they are thin!  Drive with extra caution if it rains and replace them before the snow flies.  Keep a close eye on them.   That is uniform wear, doesn’t look like alignment related wear in that picture.  WHEN a wear bar appears in 2 adjacent grooves the tire is legally worn out.  But puncture risks go way up in that last few Thousand miles. When you get wear bars then call or file a claim online.",1,comment,2,,,,
muse1b7,2025-05-29 08:11:34,tires,t3_1kxvdez,Beowulf2_8b23,"Those tires are unsafe to drive on. The uneven wear also verifies that your suspension is out of alignment. 
See if you can get a decent set of used tires from a tire shop until you can afford the repairs.",-3,comment,2,,,,
muxr9h8,2025-05-30 04:20:36,tires,t1_muse5pq,X3N0D3ATH,"Based on that photo I would give it 5/32nds at best. My eye says 3 though. I used to work for discount tire as a tech up to manager. At the end, I usually was within 1/32 by eye. These tires look about 4ish years old and based on wear should replace by end of summer at best.",2,comment,2,,,,
muy56w0,2025-05-30 05:27:14,tires,t1_musphu9,Stock_Block2130,Yes. Cupped wear indicates out of balance. But to the eye there is plenty tread. Eventually the cupping will give you road noise that won’t go away. I only buy tires from locally owned tire shops.,2,comment,3,,,,
musxfd2,2025-05-29 10:02:03,tires,t1_musmrpt,CravingStilettos,"Have you actually looked at new Goodyear or any tires? The wear bars will always show, it’s when they are at the surface then they’re (tires) “done”. OP still has ~2mm (~3/32) of tread above the wear-bars themselves.",4,comment,2,,,,
musj3xo,2025-05-29 08:39:44,tires,t1_muse1b7,AffectionateLife5693,"Can you be more specific on how you find wear uneven?

Sure I can afford an alignment, a set of new tires, new suspensions, or a new car. But I want some opinions before spending money.",2,comment,2,,,,
musu8fs,2025-05-29 09:43:45,tires,t1_musibtc,NecessaryEmployer488,"I would press it.  They should not deny the warranty it looks like minor changes between the side bars, so normal wear.     They could say the tires are not worn enough for warranty.   To me they don't look too old and bad.   It seems like they just want to sell you a new set of tires.   You can probably get another 5K miles out of them.",8,comment,2,,,,
muswmg9,2025-05-29 09:57:29,tires,t1_musi24v,g2gfmx,"Do u see how there are 2 lines going across the side of the tire tread, but doesn’t go all the way through like middle of the tread? Thats what we call wear bars on a tire. On a well worn tire, those marks would be pretty even through out.

Also 2/32nds of an inch is the legal limit. Which is 1.5mm protrusion. 2mm is pretty much replace",11,comment,2,,,,
1kytlt1,2025-05-30 11:52:27,tires,,sorintri,,1,,2,Increase tire size for winter?,"I found a great winter wheel/tire package for my car, but I'd be going from 205/50/17 stock to 215/55/17. Is that too big of a jump in size? The speedometer difference does not bother me, just worried about safety, new tires rubbing on the body, etc. TIA",5.0,https://www.reddit.com/r/tires/comments/1kytlt1/increase_tire_size_for_winter/
1kytfk6,2025-05-30 11:43:40,tires,,Fickle-Cake-4937,,1,,2,Would you change your tires in this case?,"I have Michelin Defender from 2018 and put about 8-90000km on it. The 7 yr old tires are still in a good condition according to the shop and to my eyes. They are probably good for another 2 yrs or 30000km. But I want the new Michelin Crossclimate 3 for more traction for winter driving here in Vancouver. Btw, my car is 2008 Honda Accord with 165k km in a decent condition. If I get new tires, they should be good for about 5yr or 80000km which should outlast the remaining life of the car. Does this make sense or should I wait until I really need new tires?",4.0,https://www.reddit.com/r/tires/comments/1kytfk6/would_you_change_your_tires_in_this_case/
1kynffl,2025-05-30 06:56:31,tires,,robertmedina1949,,2,,2,What is the white ring on my tire? Has powder texture. Can be taken off with finger,Bought these tires new in January ,6.0,https://www.reddit.com/gallery/1kynffl
1kyrulb,2025-05-30 10:24:39,tires,,Still_Election_9134,,1,,2,New tires smaller than expected,"I just ordered some brand new Toyo ATIII tires from Tire Rack. Had them put on my truck by a local shop and they looked small, but the size printed on them matched the ones I had taken off so I drove it home. When I got home I busted out the tape measure and measured them to be more than an inch smaller than the printed size. They are supposed to be 30x9.5 but I measured them to be closer to 29x8.5. Is this normal? Did I measure incorrectly? Between this and the fact that they installed them with the white lettering facing in, I’m having some serious buyers remorse with my $1000 purchase.",12.0,https://www.reddit.com/gallery/1kyrulb
1kyh1p1,2025-05-30 02:40:37,tires,,watermelonberriesss,,3,,2,Can I get away with a tire patch kit?,"I know that if there’s damage to the side wall it’s basically time to get a new tire. Realised it earlier while driving from the sound it made, managed to drive another 100-150km at highway speeds back home with no difference in performance. Tested with soap water 1/3 and 2/3 of the way, both times no bubbles were formed.

So can I patch this with a tire repair kit as seen in the last pic? Or is my tire screwed? 😄",42.0,https://www.reddit.com/gallery/1kyh1p1
muxknx5,2025-05-30 03:48:54,tires,t3_1kyh1p1,Anxious-Depth-7983,"You've already hit the wear indicators, so it doesn't matter those tires are shot.",2,comment,2,,,,
1kyp2ix,2025-05-30 08:10:05,tires,,BattleAggravating890,,0,,2,"Are tires quieter on the road than others, if so which are least to better?",Been wondering this question? Has Anyone experienced a quieter commute with a set of tire brand?,9.0,https://www.reddit.com/r/tires/comments/1kyp2ix/are_tires_quieter_on_the_road_than_others_if_so/
muz2fq0,2025-05-30 08:18:21,tires,t3_1kyp2ix,Skensis,100% some tires have better road noises. Typically premium brands touring tyres will try and prioritize better noise.,2,comment,3,,,,
muzcl6f,2025-05-30 09:15:04,tires,t3_1kyp2ix,66NickS,"Yes, some tires are louder/noisier than others. Some tires even have foam inside them to help with sound absorption. 

To me personally: sound is a nice to have/by-product.  I purchase tires primarily based on a combination of driving performance, longevity, and cost. I would only use noise as a tie-breaker and not as a primary decision impact.",1,comment,2,,,,
mv14wbf,2025-05-30 16:56:22,tires,t3_1kyp2ix,Package_Objective,"Absolutely, and when tires get old or low on tread the road noise will get worse and worse too. ",1,comment,2,,,,
1kyozun,2025-05-30 08:06:39,tires,,MattVT1,,1,,2,Is dry rot on my tires?,"I've had these Cooper STT Pro on my Bronco for only a few months and I noticed these cracks near the bead. Are these cracks dangerous or just a real issue? Only thing i can think of is i do air down often when going offroad, perhaps the extra flex caused it? But it's a mud tire so it should be able to handle that.",3.0,https://i.redd.it/w4k8kc0mys3f1.jpeg
1kyji88,2025-05-30 04:16:53,tires,,Several-Tutor-4325,,2,,2,Are these winter wheels/tires worth getting for $60CAD,"Hi there. I don’t know much about tires but am trying to pick up some winters for the 3 weeks ish of snow we get per year. I found these used rims & tires for $60 CAD. They are studded Hankook i*pike RW11 tires, but the seller doesn’t know the tread depth. Do these look like enough tread still to be worth buying, and is the slight cracking in the grooves okay still?",15.0,https://www.reddit.com/gallery/1kyji88
muxt63p,2025-05-30 04:29:48,tires,t1_muxs6w6,Tripleme,"Also depth is indicated by the numbers in the middle as pictured. You can see 6 almost wearing out and 4 clearly visible, that would mean there is 5 mm thread left. Not all tires have this indicator. Also keep an eye on uneven wear, some tires have sides worn out even though the middle thread is relatively unworn.",1,comment,2,,,,
1kyoqnt,2025-05-30 07:55:04,tires,,New-Development143,,1,,2,Intentional or just hit a curb?,"My mom just came home from divorce court with a flat tire. She swears my dad did it, but to me it looks like she just hit something, which she tends to do. Is it even possible to tell?",2.0,https://www.reddit.com/gallery/1kyoqnt
1kyoens,2025-05-30 07:39:37,tires,,gr33n3ggsnham,,1,,2,Selling two tires on marketplace,I have two unmounted and unused continental dws 06+s. The manufactured dates are the 11th and 20th weeks of 2023. The lowest price of the new tires are 175 per tire. I was thinking posting them as a pair for $320 and taking $300. Am I overvaluing them? What do you guys think a fair price is?,6.0,https://www.reddit.com/r/tires/comments/1kyoens/selling_two_tires_on_marketplace/
1kyoc1u,2025-05-30 07:36:11,tires,,rogerdpack2,,1,,2,Does breaking a tire bead by driving onto it damage the tire?,"Some methods of breaking tire beads seem to bend the tire tread quite a bit (like driving onto it or onto a board onto the sidewall). Like fold it basically.

Here's another that pinches the tread a bit: [https://youtu.be/pHBmhYaWeME?t=184](https://youtu.be/pHBmhYaWeME?t=184)

Can this sharp folding of the tread damage the tire?

I have seen where there is a crack in the groove of a tire after doing this, but seems to still hold air...

I guess the question is ""people smash tires to break the beads \[ex: driving onto them\], is this actually a bad idea for the tire health?"" –   
",1.0,https://www.reddit.com/r/tires/comments/1kyoc1u/does_breaking_a_tire_bead_by_driving_onto_it/
1kynx3m,2025-05-30 07:17:48,tires,,_TheShapeOfColor_,,1,,2,255 50r20 tires vs 245 50r20 tires,"I have a 2016 Ford Explorer XLT with 4wd. Currently I have the 255/50r20 tires but they're worn and need replacing. I found a nice used set of 245/50r20 Hankook Ventus tires that the garage said would work for me.

I just wanna double check that this won't be bad for or damage any other components of my vehicle. I don't do any sort of ridiculous driving, mostly just commuting/regular life errands/and the occasional road trip to visit family or friends.

Just a girl looking for opinions on my options! 

Thanks for your help, tire friends! 😊",0.0,https://www.reddit.com/r/tires/comments/1kynx3m/255_50r20_tires_vs_245_50r20_tires/
1kymzef,2025-05-30 06:37:31,tires,,matteekay,,1,,2,High performance tires that are less temperature-sensitive?,"Hey folks,

Looking for a little guidance on new rubber for my WRX. I have a set of dedicated winter wheels/tires for the snowy months (Michelin X-Ice Pro) but I need a new set for the rest of the year. 

Naturally I started looking at UHP and Extreme Performance Summer models. The problem is we tend to have nights below 40° long before and after winter so the window that I can run summer tires winds up being pretty short.

Is there such a thing as a 3-season performance tire that doesn't have the same temperature limitations? Or are UHP All-Seasons (like the DWS06+ or Pilot 4 A/S) my best option? I don't track the car but I like to push it a bit on our twisty roads.

Thanks for attending my TEDtalk!",3.0,https://www.reddit.com/r/tires/comments/1kymzef/high_performance_tires_that_are_less/
1kymlzv,2025-05-30 06:22:12,tires,,Mysterious-Cap2449,,1,,2,Toyota Tacoma Tire help,"Looking for advice or insight on tire choice. Upgrading the stock  wranglers 265/70/16 to a 265/75/16.  

Just purchased  a set of Toyo open country at3’s in SL.

Concerned if I need a higher rated LT tire.

Travel all over the US for work. All weather, highways , dirt roads, mountains etc. Once  I arrive for work I commute for a few months and then move on to next jobsite. Some weekends I like to drive far and go in some trails, nothing crazy at all, blm land , dirt roads, forests. Live skiing so out in the snow as well.

If anyone can chime in, would the lightweight passenger tire be fine for me? Not really interested in getting a super heavy tire but also don’t want punctures(dirt roads in Kansas)

Thanks!!",0.0,https://www.reddit.com/r/tires/comments/1kymlzv/toyota_tacoma_tire_help/
1kym3ff,2025-05-30 06:01:09,tires,,Not-Not-Oliver,,1,,2,Any tire shop recommendations?,"Looking for affordable options that are reliable and reputable, I got my last tires at Les Schwab but I’ve had problems with them in the past. ",0.0,https://www.reddit.com/r/tires/comments/1kym3ff/any_tire_shop_recommendations/
1kxs9mm,2025-05-29 05:54:12,tires,,TomorrowBusy1123,,80,,2,"Belle tires refused to get a nail out of my tire, said it had bad rots","I had a small nail on my front driver side tire 🛞 took my car to Belle Tire, for a small patch, as always brought me a 1900$ quote for a million other things, and said they can’t patch the tire because the tires have bad rot knowing that I bought these tires in 2022 brand new. They said they aged because I wash my car at the car wash often and that the Tire shine caused them to degrade faster. So I came here to ask what y’all think and if based on these pictures I need to change tires ASAP knowing that I just finished paying 1000$ for them like a year ago.
Thank you 🙏 
",69.0,https://www.reddit.com/gallery/1kxs9mm
murrb1s,2025-05-29 06:12:16,tires,t3_1kxs9mm,Seal-EV,Get a second opinion from another shop. These tyres does not look so bad to me. Those fine cracks do appear on all tyres. How can the shop blame the soap used to wash the car when tires live in a very hostile environment every day?,3,comment,2,,,,
murrn2l,2025-05-29 06:13:54,tires,t3_1kxs9mm,biggranny000,"They are not wrong, they do not want to be held liable or sued. Why lose hundreds of dollars in liability if something happens over a $20 patch? 

Yes you should replace the tires, might be fine driving around but their performance is starting to degrade and the chance of a blowout is quite high.

Considering the high tread levels, maybe consider getting a faster wearing but higher grip tire (all tires rot regardless). 

Keeping the tires out of the sun is the main thing to help them last long.

You should not use automatic washes on your car, that is a good way to scratch it and some of them use harsh chemicals on your paint. 

Also, you have a lot of curb rash, I would get those rims repaired because that's an eye sore. Hitting curbs can also permanently damage your tires.",-3,comment,2,,,,
murslg9,2025-05-29 06:18:36,tires,t1_murrb1s,biggranny000,"Soaps can remove the natural browning from tires that occurs to prevent them from rotting.

Tire shine accelerates it because it can prevent browning from happening. 

If OP lives in a high sunshine area and the car is outside, that will greatly increase dry rot. 

Regardless if OP bought in 22, my guess is the tires are actually much older, OP should look at the date code. 

I like detailing my car and keeping it nice, I sometimes use non-gloss tire shine, usually from personal experience my tires last 5-6 years before I see rot, but I usually wear out and replace tires before that.",10,comment,2,,,,
muqzoeb,2025-05-29 04:02:12,tires,t3_1kxkwzn,Kooky_Narwhal8184,"I'm surprised you've got a 7 year old tyre on a 5 year old car... I would have thought the car and tyre manufacturers would run tighter supply lines than that?

Or have the tyres already been replaced once with old shelf-stock?

These tyres appear to have spent their entire lives exposed to UV and extreme temperature swings.

The deep crack around the entire circumference suggests they've been running under-inflated too.

They look as bad as many tyres take 10-15 years to achieve.

Replace them.",0,comment,2,,,,
muqdg8u,2025-05-29 02:16:08,tires,t1_muqb2jb,LukissxD,"Honestly this one is F-ed get rid of it and get new ones before it blows or if you're lucky only gets flat.
As a word of advice not only wear of the tire is important the age of the rubber too as it looses elasticity over time. This kind of cracking means you need a new one ASAP",2,comment,2,,,,
1kyjps1,2025-05-30 04:25:20,tires,,Outrageous-Two3209,,1,,2,Is tire shaving safe?,I recently messed up one of my tires and am looking for an alternative to replacing all four (AWD car). Is tiring shaving safe for daily use? Thanks,16.0,https://www.reddit.com/r/tires/comments/1kyjps1/is_tire_shaving_safe/
muycigr,2025-05-30 06:02:09,tires,t1_muya71n,Mikey74Evil,"Interesting. Sorry but seems to be a way to take peoples money if that slight difference in tread wear from 3 used tires on the vehicle and a new put on. I’m looking at it this way if 3 of them are bald and you slap a brand new on then sure it’s gonna get way better grip then the other 3 then in that scenario the bald ones will be loosing traction and slipping while the new is getting grip which then intern would stress out the drive train. At this point just replace all 4 and why shave down a brand new to make it shitty aswell. Lol sorry like I said it’s a very strange concept to me. Also if the other 3 are that worn down and bad, maybe the vehicle shouldn’t be on the road. Lol",1,comment,2,,,,
muqi2gf,2025-05-29 02:38:46,tires,t3_1kxkx8y,Mister_Rogers69,"I have a spare tire from 2003, I asked the guy at the tire shop about swapping it with a different tire and he refused.  He said as long as it has been kept in a good location (trunk of the car) and shows no signs of rot/wear the age doesn’t really matter.",1,comment,2,,,,
muqmm15,2025-05-29 03:00:10,tires,t3_1kxkx8y,OkEgg2582,"Tires generally “age” due to uv rays, a petroleum products and fluctuations in weather. Those tires look fine but probably would see how the pressure holds over a month and if they stay within a 5 psi. If you have a relationship with a mechanic, see what they want to take the tires off and inspect them.  But the pics make it look like they are good to go.  This is from someone who was in the industry and consider tires one of the most important part of the safety of an auto.  I sold some wear parts that were in sand and water most days, after 10 + years someone called from that company complaining until I sent the record that showed the parts had been ordered more than 10 years.  Got a sheepish call asking if they could buy another set.  Similar wear compound as tires.",1,comment,2,,,,
muqq1ym,2025-05-29 03:16:23,tires,t1_muqo40h,acejavelin69,"My experience with Michelin truck and passenger car tires (not performance tires or the CC2 though) has not been good. In general I find a lot of Michelins wear out and develop dry rot faster than expected. This is a change in the last 5-10 years. They just don't seem to be worth the premium price in my opinion. I know others will disagree with me, but I just don't recommend them anymore. To the LTX specifically, I live in an area that gets a fair amount of snow and has pretty harsh winters, they just don't seem to get the traction they should in the winter and when temps are below freezing, which seems to just get worse the colder it gets.

Tires are a maintenance item commodity... They last a certain amount of time then you replace them. I tend to recommend quality, mid-price brands in most cases as their performance often rivals ""premium"" brands at a much better price level, giving you more for you money... Nexen, General, Falken, and Cooper are my common go to tire brands.",4,comment,2,,,,
