id,created_utc,subreddit,parent_id,author,body,score,type,matched_keywords,title,selftext,num_comments,url
mugzqg0,2025-05-27 15:05:20,tires,t3_1kwf3rm,Mr__Snek,"4 new is generally the better way to go. the runflats i mount have pretty much all been pirellis or bridgestones, and it seems like bridgestones almost always end up with complaints of a stiff ride with lots of road noise. granted, that kind of comes with the territory on runflats, but these are all on german cars with runflats from the factory, so its not like they have no frame of reference. i have no experience with the contis but they generally make excellent tires, i would be going with them to have 4 matching high auality tires.",1,comment,2,,,,
mugs7rf,2025-05-27 13:59:51,tires,t3_1kw5zz0,Gazer75,Careful with mixing tires of different age and wear on same axle. Some cars do not like that at all.,1,comment,2,,,,
1kweivq,2025-05-27 13:32:07,tires,,Aggravating_Luck6489,,0,,2,Tire peeling?,I bought a brand new 2025 Honda Accord around 6 months ago. I’m now noticing peeling (I think) on the tire. My friend says this is normal but it’s on all 4 tires.,11.0,https://www.reddit.com/gallery/1kweivq
mugpwfs,2025-05-27 13:40:50,tires,t3_1kweivq,Is_that_really_H,Unfinished tires due to cheap prices.  Keep on driving they will wear out,-5,comment,2,,,,
1kwablk,2025-05-27 09:46:19,tires,,mermaid823,,2,,2,Help solving a tire mystery,"I need people with tire experience and knowledge to help me solve the mystery of the timing of the screw.

So my tire went flat - had a long fine thread screw in it (see photo). Had to pay for a new tire (which i'm trying to get reimbursed). When i saw the tire was flat sarurday morning. my friend and i put air in it, could hear a loud hiss but couldnt see the screw, and it was flat again within 2-4 hours. 

When i left work friday the tire was fine. This tells me i picked up the screw on the way home. The drive home is at 80mph on interstate and then 50mph on main road, 20 miles total. When i parked at home, the tire looked normal and inflated.

What is the chance this screw was picked up and traveled on at that distance/speed without a blowout? Or is it more likely the screw was picked up in my neighborhood where they are doing roof, siding, and gutter construction work?

Though it is not a ""roofing nail"", i am asserting that there is no way i could have picked the screw up and driven on a leak that large for 20 miles at 60-80 mph AND had the tire still be inflated and fine when i parked and went inside my house. This says to me that i picked it up in the neighborhood, but i dont know anything about tire blowouts - thats where you come in. Help a girl out.",8.0,https://i.redd.it/qk4wmbrn183f1.jpeg
1kw76ue,2025-05-27 07:16:07,tires,,BishNish56,,3,,2,Help a girl out 😅,"Buying my own tires for the first time, I know nothing about tires and I’m trying to take advantage of the Memorial Day sales. 

For reference I live in a desert so tires don’t wear as well in a dry climate. Average driving not really a lot of freeway use more highway. Can you tell me if either of these are a good option? Thank you!!!🙏 ",34.0,https://i.redd.it/s2bbsl0va73f1.jpeg
mufcsxh,2025-05-27 08:24:59,tires,t3_1kw76ue,GronkIII,"Go with the Yokohama’s. I have a set on my Accord, and they’re super quiet in terms of road noise. They also have a 70K mile warranty, and they’re cheaper than the other tire.",1,comment,2,,,,
mufs1gj,2025-05-27 09:57:10,tires,t1_muf3in0,lost-in-the-sierras,I have Falken A/T tires first time since last fall - they’re wearing well. Idk what kind of tire or car you have but they’re definitely doing well - definitely do your research,1,comment,2,,,,
muf5y6d,2025-05-27 07:44:31,tires,t1_muf54l4,GronkIII,"If they’re wearing on the outside, that usually means either they’re under inflated often, or you have an alignment issue. How often do you check your tire pressure?",1,comment,2,,,,
1kwcmx4,2025-05-27 11:46:00,tires,,No-Database-9164,,0,,2,Tire shop,"I’ve been in the auto business for 8 years now, 40k budget, out of Detroit. I know the business enough in this area so I’m not here asking for business advice or anything like that. All I want is a full list of all equipment I need for a tire shop, I’d appreciate the help,
Thank you ",5.0,https://www.reddit.com/r/tires/comments/1kwcmx4/tire_shop/
1kwbyn7,2025-05-27 11:10:44,tires,,plaugeseeker1111,,1,,2,"3mm Tires, USA","I would like to start off by saying I'm a younger first time car owner and I can't really talk to my father so please dont bully me, I'm looking for help and very worried

My tires on my car are currently at 3mm I'm getting them replaced late next week bc that was the soonest I could buy them + have them put on but I'm worried bc I know 3mm is super low, how much longer can I drive on them safely? I have a doctor's appointment coming up and it's 60 miles there and back plus 40 miles to go to work the next 4 days, will that be okay or should I try to find another car to drive in the mean time? The mechanic seemed very worried which is making me very worried ://

I don't plan on going on any highways and will be taking back roads everywhere so Im hoping that helps too",4.0,https://www.reddit.com/r/tires/comments/1kwbyn7/3mm_tires_usa/
mukx9oj,2025-05-28 05:35:29,tires,t3_1kwbyn7,ADayCareReject,"New, car tires are about 10/32nds of an inch (~8mm) of tread. Absolute end of life is 2/32nds (~1.6mm) which is the height of the wear bar indicators, raised bumps in the main grooves of the tire. Generally, there is a noticeable degradation of performance starting around 5/32nds (~4mm) - but mostly snow traction. Wet performance and braking distance rapidly starts degrading in the 3-4/32nds (~2-3mm) of tread life.
Hopefully that is helpful and provides some context - but depending on how much you drive - it would be wise to start planning for tire replacement before the next wet/cold season.",1,comment,2,,,,
1kw99f4,2025-05-27 08:52:42,tires,,PhilosopherCurious97,,1,,3,Normal wear?,"Does this look like normal wear? If not, feel free to speculate what went wrong. The hole is on the inner part of the tire. ",10.0,https://www.reddit.com/gallery/1kw99f4
mufmpvr,2025-05-27 09:24:47,tires,t3_1kw99f4,Kfuller_85,Likely caused by a failing suspension part. All those ball joints and rods hold the wheel straight in tandem together. The abnormal wear looks like your wheel is slanted that the inside wears faster - Your Friendly Neighborhood Tireman,1,comment,2,,,,
muqs6al,2025-05-29 03:26:28,tires,t3_1kw99f4,PhilosopherCurious97,The tire guy said there is nothing obviously wrong. They are directional tires and as they wear this can happen..,1,comment,2,,,,
mufou9z,2025-05-27 09:37:46,tires,t1_mufo43u,Celiac5131,Ok sorry. Definitely not normal wear pattern.  Yes the tire place or repair place will be able to help you.,1,comment,2,,,,
1kw8xlo,2025-05-27 08:36:43,tires,,Disastrous_Grade_501,,1,,2,Best of these summer tires?,"Hello everyone, 
I’m looking for summer tires for my car. I live in Greece, it rarely ever rains and temps are relatively high all year round, I don’t care too much about wet performance as I have a second car I can use in the event of really strong rainfall or snow, only other thing I care except from dry performance is mileage, I want them to last at least 30k km (20k miles)

My car is a Honda civic with 150hp so not too powerful but it gets driven pretty hard. However its 15 inch wheels mean that most new tires aren’t available. 
What I’ve found so far are: 
Continental Ultracontact,
Goodyear EfficientGrip Performance 1 (not 2)
Falken ziex ze310 
Bridgestone t005 
Hankook Venus prime 3
I also found Toyo’s proxes tr1 that many people say outperform the previous ones however they also say last a lot shorter.
Thanks in advance to anyone who took the time to read this and help! 

",2.0,https://www.reddit.com/r/tires/comments/1kw8xlo/best_of_these_summer_tires/
muba3ws,2025-05-26 17:59:20,tires,t3_1kvpc83,MiscreatedMonster___,"The thing you circled doesn't look like a thread wear indicator, usually they are flat between two blocks, I think you can even see them on one of your pics barely.

But the tires it self look bit older then 2 years. What is the manufacture date of them (DOT)?",2,comment,2,,,,
mub8no3,2025-05-26 17:44:49,tires,t3_1kvpc83,Is_that_really_H,"Purpose of the Tread Wear Indicator:
	•	These bars appear when the tread wears down to approximately 1.6 mm, the legal minimum depth in many regions.
	•	Once your tread is level with these bars, it’s time to replace the tyres — regardless of how the rest of the tyre looks.

Your Current Tread Depth:
	•	You mentioned 5.6 mm tread remaining. That’s a healthy depth, especially after 24,000 km of use.
	•	Most new tyres come with 8–9 mm, so you’ve used about 30–35% of the tread life, which is normal and shows even wear — that’s good news.

At your current rate, you can likely get 45,000–55,000 km safely out of the set, depending on driving style and alignment.",1,comment,2,,,,
1kw7vgl,2025-05-27 07:46:56,tires,,Dry-Consequence-6509,,1,,2,Tires for 2023 Nissan Pathfinder,"Best tires for a 2023  Pathfinder SV? Standard runaround car in the south east USA. 

Any thoughts on the Kumho Crugen they come with? And what to change to if I should change",2.0,https://www.reddit.com/r/tires/comments/1kw7vgl/tires_for_2023_nissan_pathfinder/
1kw1kmz,2025-05-27 03:22:45,tires,,eidam655,,2,,2,What's the correct pressure for this tire?,"Hello everyone,

The car I am currently driving has four tires with the size 225/45 R19 96W.
However, the label on the door lists only tire spec of 225/45 R19 96W XL. 

Will I be safe ignoring the XL or should I follow a different section of the label? The tire has a max pressure of 50psi, as stated on the tire wall. ",33.0,https://www.reddit.com/gallery/1kw1kmz
mugo9j9,2025-05-27 13:27:46,tires,t1_muglqmb,ItsTyre,"It looks like she’s pretty close to the wear bars in the central grooves, so you are due for a replacement soon regardless of this damage.

If you have to prioritise, fix your alignment first, then fix your tyres. But best to do it all at once.",1,comment,2,,,,
1kw6ahq,2025-05-27 06:37:12,tires,,c1uk,,1,,2,Continental AllSeason wear,"I have this for roughly 3500 km. They are on a Toyota Corolla, driven only in the city the way a hybrid car is usually driver, gentle acceleration, gentle break. Car also comes with pressure sensors, they were driven on the correct pressure all the time.

I feel like the wear is way to big for the first 3500 km.

They are 4 brand new dot 2024 Continental CrossClimate.",0.0,https://www.reddit.com/gallery/1kw6ahq
muek1jl,2025-05-27 05:42:42,tires,t1_muej2zm,Bayquin,It is generally reccomended to replace your tires once you hit the wear bar.,1,comment,2,,,,
1kvyzck,2025-05-27 01:40:13,tires,,pbo_odq,,2,,2,"Nail in summer tire, is it repairable?","Spoke to two mechanics… one said it is fine to repair the other said no.

Tire is Hankook Venus S1 Evo3 summer tire.",5.0,https://i.redd.it/jtpokmbxm53f1.jpeg
1kw2jy2,2025-05-27 04:02:19,tires,,orangekronic23,,1,,2,"Hi, got a tire question","I picked up some wheels with 2015 tires on them. They were never used and these tires look brand new, still got paint on the treads. Pirelli P zero’s, no cracks/splits, no dry rot, they look fantastic like they just came from the factory. should I pitch them because of their age? thanks ",5.0,https://www.reddit.com/r/tires/comments/1kw2jy2/hi_got_a_tire_question/
1kvws0k,2025-05-27 00:10:34,tires,,Stormblessed1057,,2,,2,How bad off are my tires?,How bad off are these tires? Can I put off buying tires while I save up for a good set or is it s rush out and replace immediately? The truck is not driven frequently or far.,7.0,https://www.reddit.com/gallery/1kvws0k
1kvvm54,2025-05-26 23:22:32,tires,,JosiaJamberloo,,2,,2,This is my first time buying new tires. Should I spend the money and get good ones?,"I've found some I like from a tire brand I've never heard of for around $750.  But could get LT tires for double that from Goodyear. 

They're for a work truck.  I do landscaping and pull a trailer and we do some very light off roading when we go camping. 

I think I would rather get the better ones for the peace of mind, but it's it worth it in the end? 

I could get 2 sets of these other tires for the same price as one. 

I have a feeling I know what you guys will say, but I did want to get some advice and check with some people.",33.0,https://www.reddit.com/r/tires/comments/1kvvm54/this_is_my_first_time_buying_new_tires_should_i/
muck0z8,2025-05-26 23:36:41,tires,t3_1kvvm54,ForeverReasonable706,"How many miles do you put on, I would like to see the tires off in 4 years of use just because of age, if I have someone that drives low miles I try to get them into a more cost-effective tire with the idea that it gets replaced when it's older but probably has tread, in my opinion Hankook has been one of the better values out there as far as cost vs quality and wear, I have had good luck with many of the budget tires I have available but there's been some dogs but my supplier doesn't keep them if there a problem so they usually weed out the bad ones",3,comment,2,,,,
1kvvi28,2025-05-26 23:17:45,tires,,sulphurwind,,2,,2,Tyre need changing?,"Does it look like this tyre needs changing ? Will be two rear ones both same condition, threads at about 3mm.",10.0,https://www.reddit.com/gallery/1kvvi28
mudb2d4,2025-05-27 01:53:25,tires,t1_muda87k,sulphurwind,"They are Michelin Primacy and a tyre shop did mention that Michelin are ""softer"" tyres compared to other brands so more wear tear. This is a 2018 vehicle at 77k miles. On average it's high mileage.",1,comment,2,,,,
1kw0nqe,2025-05-27 02:46:22,tires,,boiledsweetpotatoe,,1,,3,DWS06+ Alignment Wear,"Hi all, I just put on brand new Continental DWS06 Plus tires on my car and have driven about 200km on them so far. This is what the side alignment wear indicator shows, on all 4 tires. The right most rectangle is worn out the most compared to the other two. Does it mean my tires will become cupped or scalloped in the future?

Prior to installing these brand new tires, I had aftermarket wheels on with different tires that got cupped from excessive toe and it got fixed a year ago. I’ve since put on my FACTORY wheels that are in good condition with no bends or anything and balanced out perfectly. Ride is smooth and quiet now but I’m afraid of developing the same issue again in the future and having to spend $2k on tires again.",1.0,https://i.redd.it/866a5uiqy53f1.jpeg
1kv93ul,2025-05-26 03:12:40,tires,,kevMcalister,,39,,3,Cheap tire vs premium experience,"Just some of my advice from my own experience. 

Cheap brands like Walmart LionHeart or the dirt cheap options on tire rack. I’ve bought them and the premium Pirelli, Michelin etc as a Uber driver who puts 40k a year on my cars

 If you are broke and don’t have enough money, buy the cheap shit to get by. But from my experience the LionHarts and other cheap brand have constantly had huge bubbles on the sidewalks after a pot hole. While the premium brands have not. Cheaper don’t handle as well in rain or snow. Also, seem to wear faster.

So you aren’t really saving $$$ due to replacement over time or a pothole. You are just spreading how much you have to pay over time. Which for some people are the only option. 

Many will hate this advice but if you want the best of both worlds (price/brand) you can get premium used brands (7 or 8/32nds) off eBay or united tire for the price of a new cheap brand. I’d rather have a pirellis run flat used than a brand new LionHeart. That’s my advice ",52.0,https://www.reddit.com/r/tires/comments/1kv93ul/cheap_tire_vs_premium_experience/
mu8jfb2,2025-05-26 06:10:29,tires,t3_1kv93ul,ccoastal01,"There's also a lot of good mid priced options like General or Falken. They'll last longer and feel a lot better to drive than the dirt cheap brands but without paying the Michelin tax.

In fact you can see many cheaper touring/grand touring tires outperformed the Michelin Defenders and CrossClimate II's in Tire Rack's tests. [https://www.tirerack.com/tires/tests/testDisplay.jsp?ttid=336](https://www.tirerack.com/tires/tests/testDisplay.jsp?ttid=336)

Now the Defenders are designed for durability above everything but if you're someone like me who only drives 5000 miles a year they are gonna age/rot before the treads wear out anyways so might as well save a few hundred and get a set of Falkens (which is what I just did).

But a brand new Ling Long is still gonna be a lot safer and feel better to drive than a worn out Pirelli or Michelin so the important thing is you get new tires when yours are worn out.",6,comment,2,,,,
mu98hpo,2025-05-26 08:39:01,tires,t3_1kv93ul,BadFun6079,No need to debate which one is better. There are rating on tires . Traction and wear . Compare them and make a decision. I owned a tire shop and let me tell you that Michelin Perelli’s Bridgestone’s Dunlops Continental Goodyear make fantastic tires and the cheap Chinese brands don’t come close with technology and construction. With the thousands of tires I’ve sold and installed one brand stands out as the gold standard and it’s Michelin ! Yes there’s exceptions but you can’t go wrong with Michelin tires.,5,comment,2,,,,
mu82qo1,2025-05-26 04:41:50,tires,t3_1kv93ul,teakwoodtile,"I've owned both cheap and expensive tires (Conti, Michelin vs Sailun, Kumho, Nexen, Imperial). Haven't noticed much of a difference in performance, wear or comfort between them. Only issue with cheaper ""off brand"" tires is that they're not readily available if you need a new tire due to damage. That's the only downside I've experienced. 

Everyone has different opinions though and some people feel better buying expensive, top line tires - to each their own.",2,comment,2,,,,
muhyj0w,2025-05-27 20:33:23,tires,t3_1kv93ul,rreed1954,"Where do Sumitomo tires fall on the durability list?  My own experience with them is with a set I installed on a Tacoma pickup.   They lasted over 50,000 miles (at which time I had traded the truck in) and were still usable with acceptable wear.  They are a mid to lower-priced tire.",1,comment,2,,,,
mu83i7j,2025-05-26 04:45:55,tires,t3_1kv93ul,ChevyGang,Pirelli isn't worth it IMO. They bubble and wear fast. There's a thread on the Mercedes forums where owners are replacing pirelli tires every few weeks due to potholes.,0,comment,2,,,,
muk5bgf,2025-05-28 03:22:11,tires,t1_muhyj0w,anotherteapot,"Realistically tire life is down to a limited set of factors:

* How you drive
* Where you drive
* What you drive

If you drive a Tacoma somewhere with a temperate climate, smooth roads, and aren't racing around, you're gonna have great tire life with the majority of tires you can buy - the exceptions are tires geared for certain performance characteristics, like off road use, load rating, section width, etc.  Conversely, if you drive the same vehicle in the same climate and do more than drive easily on smooth pavement, you're going to get different treadwear and efficiency.  Live in a colder climate and you will likely see an increase in total treadwear, same if you live someplace hot.  Go on a lot of dirt or gravel roads and you get higher treadwear.

Different tires are really designed for different things.  Remember to select a tire that matches your vehicle, your intended use, and your climate.",1,comment,2,,,,
mu95ost,2025-05-26 08:21:46,tires,t1_mu83i7j,kevMcalister,I haven’t had any issues with them. No bubbling over crazy potholes and BMW Mercedes have alignment from factory that are meant for handling and hugging the road. So they wear out faster than other car brands. I get my alignment to be more flat sitting and my tires last longer,3,comment,2,,,,
1kvuts9,2025-05-26 22:49:34,tires,,tsuabsa90,,1,,2,Nail in tire,Had a nail in tire for over a year now.  TPMS is installed and it's not showing any decrease in PSI.  Is it still advisable to take it to a shop to remove and patch it up?,2.0,https://i.redd.it/anks3dnhs43f1.jpeg
1kvtjw0,2025-05-26 21:50:32,tires,,Gamer_reader,,1,,3,Tire for Royal Enfield super meteor 650 for a heavy rain season,"I am living in an area with very high humidity (10 km from the coast). Bought my bike 2 and a half months back and have been using stock tires (Ceat). It rains a lot here for 4 months starting mid of may. 
Now I am scared that the tires gonna skid on some turn on wet road. 
I have decided to change my tire but don’t know which one to go for as I haven’t really ever looked into tyres and this is my first vehicle.

One more thing which I would like to know is that are there certain tyres out there which perform well on wet road but it’s better to switch to other tyre when the season is dry as it remains completely dry here for 6 months or I can just keep on using the new tyres all the time",0.0,https://www.reddit.com/r/tires/comments/1kvtjw0/tire_for_royal_enfield_super_meteor_650_for_a/
1kvkqsv,2025-05-26 12:41:29,tires,,Jpinkmh,,5,,2,Husband hit curb with fairly new tires. How soon do we need to replace this?,"We literally just bought these tires in the fall. My husband is currently out of a job so it's a pretty big expense for us to replace it, but I'm definitely all for being safe. Does this seem like an artificial tear or do we need to replace ASAP? ",7.0,https://www.reddit.com/gallery/1kvkqsv
1kvsya2,2025-05-26 21:20:01,tires,,younisphilia,,1,,2,No spare.. Flat tire precaution,"Hi everyone 

I replaced the run flat tires on my BMW 3 series with normal tires.. 

Given that BMWs dont come with spare tires or even space to have one.. to mitigate the risk of flat tire I have 
1. Tire repair kit 
2. Tire air compressor/inflator that works on 12v
 Any suggestions for extra precautions to take? ",1.0,https://www.reddit.com/r/tires/comments/1kvsya2/no_spare_flat_tire_precaution/
1kvdy5b,2025-05-26 06:44:57,tires,,noe319,,10,,2,Are my tires damaged from gravel driveway?,I park in a gravel driveway at work where my car sits for 8hours a day. Recently I got one of my tires plugged and the repair guy noticed some chunks missing from my tire. Could parking on this stone cause this and are the tires still safe to drive on?,23.0,https://www.reddit.com/gallery/1kvdy5b
mublk1y,2025-05-26 19:50:38,tires,t3_1kvr9d6,None,"You can make it somewhat the same size rim and tyre combined if you go with a thicker side wall/profile tyre for the 19inch

For example a 19-inch tire with a 245/40/19 size might be comparable to a 20-inch tire with a 245/35/20 size",1,comment,2,,,,
1kvr5g9,2025-05-26 19:34:33,tires,,Aranka_Szeretlek,,1,,4,New tires rubbing noise?,"So heres a possibly dumb question: I have just gotten new tires for the first time in my life, and I can hear them kinda screeching - is that normal? Ive tried to look on Youtube for similar noises, but I couldn't find it. It does not sound like a bearing problem (as far as I see on YT) because there is no clicking noise. It really sounds like rubbing plastic, and it seems to come from all wheels, mainly when the car is turning.

I am a bit worried because the winter tires were 16 inches and the summer ones are 17, but they were just put on at the shop without adjusting anything at the suspension. I don't know if thats OK, or could the sound be caused somehow by this?

The tires are 205/50 R17 Uniroyal on a Renault Megane.",4.0,https://www.reddit.com/r/tires/comments/1kvr5g9/new_tires_rubbing_noise/
1kvb28l,2025-05-26 04:37:32,tires,,Sea_Bumblebee_5945,,17,,2,How much life left?,"I have a 2022 toyota Tacoma with stock Goodyear wrangler territory at. So just about 3 years old with 20,000 miles. 

All of of sudden seems like a lot of wear, especially down the center.

I added pictures of the 4 tires and the spare for reference.

Any thoughts on how much more life I can expect from these?",11.0,https://www.reddit.com/gallery/1kvb28l
mu99yxa,2025-05-26 08:48:05,tires,t3_1kvb28l,Disastrous-Set-3390,Those tires usually get you about 40k-45k total miles. They’re pretty good tbh and you have about half wear on them. As long as you’re doing your rotations consistently you’ll probably get the full 45k,1,comment,2,,,,
mu88md9,2025-05-26 05:12:57,tires,t1_mu88139,Insanely_Mclean,I just use the wear bars on the tire as a reference. That's literally why they exist.,2,comment,2,,,,
1kvia82,2025-05-26 10:23:31,tires,,Exact_Gear_3139,,5,,2,How many more miles can i get out my tires,That’s my front a rears you think I got till next winter?? My shop says I need new tires I feel like they are trying to scammmm me!!! Everyone talking about when it rains man a boat don’t sink to grab traction it floats.,96.0,https://www.reddit.com/gallery/1kvia82
mub1yx3,2025-05-26 16:37:59,tires,t3_1kvia82,TheyCantCome,"I’m a person who will usually replace tires near their wear bars, actually I do burn outs and bring them down to the wires when they get to the west bars then replace them. With off road tires you really lose a lot of performance off road even at 6-8/32”.",1,comment,2,,,,
mubxukw,2025-05-26 21:26:36,tires,t3_1kvia82,Iasc123,"The uneven tyre wear tells me, this tyre has been over inflated! Here's what I'd do, under inflate them, so they wear on the outside, loads of tread there!",1,comment,2,,,,
muakqid,2025-05-26 14:01:24,tires,t3_1kvm00k,Mr__Snek,"looks like it was overinflated and wore the center down. did the vibration stay in the same spot or follow the wheel? did you just rotate, or did you balance them too? whens the last time you had an alignment or had your suspension looked at? there are a thousand things that can cause vibration, either directly by being loose/worn or indirectly by causing uneven wear to the tires which leads to vibration over time",2,comment,2,,,,
