id,created_utc,subreddit,parent_id,author,body,score,type,matched_keywords,title,selftext,num_comments,url
mv00knj,2025-05-30 11:33:03,electricvehicles,t1_muzzsyj,Sagrilarus,"Sounds like a wheel out of balance.  That should cost $50, and worth going after first.


Bad alignments chew up tires.  If your tires are wearing evenly it's probably not misaligned.",1,comment,2,,,,
muv006l,2025-05-29 19:47:12,electricvehicles,t3_1kxu7oq,RobotMower,"Delivery Checklist

Checklist of important items to verify when taking receipt of a new EV or looking to buy used:

Exterior Inspection

1.	⁠Paint Quality: Check for any scratches, chips, or imperfections.
2.	⁠Panel Alignment: Ensure all body panels are aligned and there are no gaps.
3.	⁠Glass: Verify that windows, mirrors, and sunroof (if applicable) are free of cracks and chips.
4.	⁠Tires and Wheels: Check for any damage and ensure tires are properly inflated.
5.	⁠Lights: Test all exterior lights (headlights, taillights, turn signals, etc.) to make sure they function properly.

Interior Inspection

1.	⁠Seats and Upholstery: Inspect for any tears, stains, or other damage.
2.	⁠Dashboard and Controls: Ensure everything is working, and there are no scratches or blemishes.
3.	⁠Touchscreen Display: Check for proper functionality and responsiveness.
4.	⁠Interior Lights: Test all interior lights, including those in the trunk and glove compartment.
5.	⁠Trunk and Frunk Space: Verify that the trunk and frunk (front trunk) open and close properly and are free of damage.

Functional Checks

1.	⁠Key Fob/Card: Ensure you have all provided key fobs/cards and that they function properly.
2.	⁠Battery Level: Check the initial battery level and charging status.
3.	⁠Charging Port: Inspect the charging port for any damage and test it with a charger.
4.	⁠Software: Verify that the software is up to date.
5.	⁠Autopilot and Full Self-Driving (if equipped): Test these features to ensure they are working correctly.

Paperwork and Documentation

1.	⁠Owner’s Manual: Make sure you receive a copy of the owner’s manual.
2.	⁠Registration and Insurance: Ensure that all necessary documents are correctly filled out and provided.
3.	⁠Warranty Information: Verify that you have all warranty documents and understand the terms.
4.	⁠Service Records: If applicable, check for any service records or reports.

•	⁠Have them Print and verify the alignment from the factory.

Test Drive

1.	⁠Acceleration and Braking: Test the car’s acceleration and braking.
2.	⁠Steering: Check for any unusual noises or vibrations.
3.	⁠Suspension: Ensure the ride is smooth and there are no unusual sounds.
4.	⁠Climate Control: Test the air conditioning and heating systems.
5.	⁠Infotainment System: Test the radio, navigation, and any other infotainment features.

Other Checklist References:



By going through this checklist, you can ensure that your new EV is in perfect condition and ready for the road. Enjoy your new ride! 🚗⚡",-1,comment,2,,,,
mukloze,2025-05-28 04:40:32,electricvehicles,t3_1kwwe7t,likewut,"The brake dust thing should have been apparent - EVs pretty much never need new pads. But I didn't know brake dust was so much worse than tire wear in terms of it becoming airborne. And even with the added weight of EVs they still produce 38% less total brake, tire, and road wear emissions. 

So as we move to EVs, hopefully we can capture some of the tire wear particles in the drainage systems around interstates - but that will probably never happen. Or produce tires that pollute less. Neither option as good as trains/public transportation, but wouldn't require the investment or public sentiment shift.",101,comment,2,,,,
muptdyp,2025-05-29 00:38:47,electricvehicles,t3_1kwwe7t,McMonty,Nice! Next up: tire wear 🤞,1,comment,2,,,,
muqmlyh,2025-05-29 03:00:09,electricvehicles,t3_1kwwe7t,ruly1000,One of the one sided criticisms of EVs is that they produce more particles from tire wear.  EVs are heavier and have more torque so they have more a bit more tire wear but they also produce no exhaust particulates and a lot less brake dust.  Does anyone know how this balances out compared to an ICE vehicle?,1,comment,2,,,,
muu4ff4,2025-05-29 14:50:26,electricvehicles,t3_1kwwe7t,Camkode,Offset by the increase in tire wear perhaps? Would be interesting to see further studies and comparisons.,1,comment,2,,,,
muns70w,2025-05-28 16:22:32,electricvehicles,t3_1kwwe7t,rimalp,"Great!

Now work on tire wear!

EVs are heavier and have way more torque. It results in significantly more tire wear. Which means a lot more particles ending up in the air and oceans.

It's estimated that roughly ~30% of *all* microplastic particles in the oceans is from tire wear ([source](https://www.theguardian.com/environment/2022/jul/25/tyre-dust-the-stealth-pollutant-becoming-a-huge-threat-to-ocean-life)). And it's only about to get worse with EVs, if the issue is not addressed ASAP.",0,comment,3,,,,
muzlx1d,2025-05-30 10:08:38,electricvehicles,t1_mukkc3d,your_anecdotes,I think you missed the part of now there is a lot of tire dust as tires wear faster in EVs,1,comment,2,,,,
munsfb5,2025-05-28 16:24:49,electricvehicles,t1_mukloze,rimalp,"EVs do not have less tire wear, they have more.

EVs are heavier and have *way* more torque, it leads to *increased* tire wear. People just like acceleration.

Also keep in mind the Electrek is a Tesla fan blog, not a news site. They will always try to add a good Tesla story to their blog posts. Same in this one. Where they just had to compare the weight of the Model 3 and BMW 3. Blissfully ignoring the immense torque difference...

It's estimated that roughly ~30% of *all* microplastic particles in the oceans is from tire wear ([source](https://www.theguardian.com/environment/2022/jul/25/tyre-dust-the-stealth-pollutant-becoming-a-huge-threat-to-ocean-life)). And it's only about to get worse with EVs, if the issue is not addressed ASAP.


EVs are great for all of the emission reductions that come with them. But the increased tire wear must be addressed, not ignored.",0,comment,3,,,,
mun6svi,2025-05-28 13:18:15,electricvehicles,t1_mukychn,SarcasticOptimist,"It's mostly the increased tire wear right wingers bitch about now. Which can be handled with smaller vehicles (since EVs are better packaged anyway, see the MT1 or Slate compared to an average pickup) or harder compounds. Considering they often drive empty pickups and wanted the Challenger EV to do donuts it's hypocritical.",4,comment,2,,,,
mukoom6,2025-05-28 04:54:47,electricvehicles,t1_mukmsik,Kimorin,"the tire thing is overblown... i'm at 110000 kms and still on first set of tires, although to be fair i did pick high wear rating tires and I swap to winters in winter. I sold the factory one within like the first month",7,comment,2,,,,
mukpv56,2025-05-28 05:00:21,electricvehicles,t1_mukmtbs,HughberryPie,"From the article “Even using the study’s 20% number for EV. vs. gas car weight, this doesn’t handicap EVs much. BEVs produce 38% less total brake, road and tire wear combined, without even taking into account their exhaust benefits.”",9,comment,2,,,,
muzqoul,2025-05-30 10:36:18,electricvehicles,t1_muzlx1d,Malforus,"Someone else posted that and I replied to them.  It is a concern and definitely merits investigation.  

However I don't have the data in front of me to know comparatively if it is a wash or not.  

Yes tires for evs wear faster but by how much?  

That does mean net net they could offset but it's not yet known.",1,comment,2,,,,
muqe9mf,2025-05-29 02:20:12,electricvehicles,t1_mup7m0l,Malforus,"Tires are a huge issue given the torque and how people love to use all that power all the time.  Aggressive Tire wear is absolutely causing tire particulate pollution, especially so if people are doing burnouts or skids.

I am definitely not doing burnouts but its going to be interesting the ""High profile burnouts"" vs the statistical increase in tire wear and the resultant ecological impacts.

Heavier vehicles wear out tires faster that's true but I am curious if the vehicles in regular driving are contributing that much more.

Can't speak to the idea that 'drum brakes don't rust' though.",2,comment,2,,,,
muksfct,2025-05-28 05:12:40,electricvehicles,t1_mukoe91,StarsandMaple,"Yeah, I think once manufacturers get out of only pushing high margin cars ( heavy powerful SUVs ) we’ll see that well thought out EVs will weigh similarly to ICE vehicles. 

I think the heavier tire wear comes from the high instant torque. Brother Mach-E goes through tires a bit faster than a comparable weight sport SUV, but those other SUVs don’t have near the power.",19,comment,2,,,,
muooy5o,2025-05-28 21:06:52,electricvehicles,t1_munsfb5,likewut,I didn't say EVs had less tire wear...,2,comment,2,,,,
mukpoyq,2025-05-28 04:59:33,electricvehicles,t1_mukodjz,HughberryPie,"Not the most helpful attitude but the comment makes a good point. “Even using the study’s 20% number for EV. vs. gas car weight, this doesn’t handicap EVs much. BEVs produce 38% less total brake, road and tire wear combined, without even taking into account their exhaust benefits.”",5,comment,2,,,,
mukt7df,2025-05-28 05:16:21,electricvehicles,t1_mukpv56,prsnep,"I wouldn't lump the brake and tire wear into one. I would think that exposure to microplastics is much worse.

It's commonly accepted that EVs produce more tire wear. Maybe modern EVs fare better. [EV Tire Wear and Maintenance | Kal Tire](https://www.kaltire.com/en/EV-tire-wear-and-maintenance.html#:~:text=Not%20only%20are%20EV's%20heavier,your%20tires%20on%20an%20EV.)",-2,comment,2,,,,
mukvipx,2025-05-28 05:27:15,electricvehicles,t1_mukt7df,Ancient_Persimmon,">I would think that exposure to microplastics is much worse.

I would suggest taking a look at what brake pad material is made of first. 

There are way more variables with tires because different types of tires have widely different wear characteristics and driving style differences also play a major role in wear. 

Something that doesn't get mentioned with regards to tires and EVs is that most EV specific tires start out with 20-30% less rubber to begin with.",2,comment,2,,,,
mulsfx3,2025-05-28 08:17:53,electricvehicles,t1_mukp9gl,SoylentRox,"Nobody wants that lol, heavier batteries are here to stay because the high longevity chemistry (LFP) is heavier.  Solid state batteries are a way to get even more range.  


The easiest solution to this problem is to have emissions standards for tire compound.  Both in composition (some compositions are less toxic) and quantity (some tire chemistry wears way less per mile)",17,comment,2,,,,
muo0hdr,2025-05-28 17:44:44,electricvehicles,t1_mumj97a,General_Albatross,"I'd like that, to limit the wear on tires.",1,comment,2,,,,
mupwda7,2025-05-29 00:52:42,electricvehicles,t1_muptd05,Ancient_Persimmon,"Tire wear is predicted on driving style and conditions, plus the specific design of the tire in question. 

Making generalizations beyond that doesn't have a lot of validity.",1,comment,2,,,,
muiafot,2025-05-27 21:52:37,electricvehicles,t1_mucyk4i,LeifCarrotson,"It's all about the press, and not about the actual numbers. 

The real costs of maintaining an ICE car may be higher, but people don't think about those costs when considering aggregate cost-per-year.

The annual cost of a car is the sum of, in approximately decreasing order: 

- Depreciation: (Purchase price - sale price) /  Average years of ownership

- Yearly insurance premiums

- Fuel costs, including fuel taxes

- Electricity costs

- Tire cost / Average years of tire life

- Unexpected repair costs (Alternators/belts/water pumps/AC/power steering pumps/ball joints that frequently wear out)

- Expected Maintenance costs (12V battery, oil changes on ICE, air filters, etc)

- Registration fees

- ""EV taxes"" (if applicable)

You can add all those things up, and then divide by average annual miles driven to get a cost per mile. 

Most people I know calculate cost per mile of a trip in their heads as just: 

    Miles driven / Miles per gallon * Fuel cost per gallon 

and ignore all the other factors, so a 100 mile trip costs 100 miles / 20 mpg = 5 gallons x $3/gallon fuel = $15 or $0.15/mile. In reality, it's more like $0.50/mile with all costs considered, and highly variable depending on the price, weight, and age of the vehicle. 

And as you say, most people just get an unpleasant surprise when they go to renew - this tax isn't relevant to their cost-benefit analysis except insofar as it comes pre-packaged in a shared feeling that ""EV taxes are expensive"". 

I feel it's also relevant to include the value of my time in the vehicle: When commuting, I'm not enjoying my time in the car. I'm not able to relax and read or multi-task like on public transport, and I'm not enjoying my time outside like on a bike, it's just precious minutes of free time slowly dribbling away. At work, I sell my time to my employer for a significant amount of money, and biology forces me to give away hours per day to sleeping and hygiene and eating (to the extent the latter is not pleasant), so my few hours of free time per day are quite valuable to me.",1,comment,2,,,,
mue1o8q,2025-05-27 04:05:52,electricvehicles,t1_muds2xr,VTbuckeye,Except for or when you replace a tire/tires due to road hazard versus treadwear. I can see it now...hit nasty wide/deep pothole causing a bubble in the sidewall of two tires on AWD car 15k miles into a planned 45k miles of wear. Now you have to replace all 4 tires that are only 1/3 used.,8,comment,2,,,,
muctruh,2025-05-27 00:26:25,electricvehicles,t1_muc2n5m,Terrh,">  maintenance costs are zero.

how do I get on this plan?

My tesla's maintenance costs are anything but zero.  

Tires, wiper blades, annual brake service, ball joints, control arms, ICU screen replacement, you name it... 

Unless we're calling every wear and tear item not maintenance now, in which case... your miata's maintenance costs are also zero.",0,comment,2,,,,
mukfch1,2025-05-28 04:09:54,electricvehicles,t1_mubx732,jimschoice,"They are still using it, just through the brake pedal.   Shouldn’t affect brake wear at all vs using the OPD. 

Most EVs do regenerative braking first when using the brake pedal. Hyundai / Kia are the only ones I of that you can turn it off completely.  And of course Tesla does not regenerate at all by using the brake pedal.",1,comment,2,,,,
mu7r5xe,2025-05-26 03:40:44,electricvehicles,t3_1kuzhmi,TradeTraditional,"Option 1:  
Purchase something older like a Leaf or a good hybrid like the Insight or first gen Prius. Yes, those have a motor, but they also are nearly indestructible as they are pre-Covid and worlds simpler as a rule to fix and maintain.  I mention this as they are now considered old, slow, and low range.  Yet are fine for getting around a small town or city for very little money.  
Option 2:  
Depending on where you live, the most reliable and lowest cost to own option overall might be a Honda Civic GX.  This is a natural gas powered Civic with about a 180 mile range.  Fills up like your city busses and so on do, (CNG filling station) and the engine has nearly zero wear issues, nearly zero pollution, and it's 2/3 the price of gas per gallon equivalent.  This can be about the same price as EV chargers in most cities.  The downside is finding one as people never sell them (usually 2 or 3 for sale in the entire U.S.). These routinely do 250-300K miles before they wear out.",0,comment,2,,,,
mu6ab2e,2025-05-25 23:12:48,electricvehicles,t1_mu62r4q,dbmamaz,do you own an EV? these dont seem to be issues as much any more.  high insurance as mostly for teslas and tire wear seems to be lessening.  i wonder how much is just due to jackrabbit starts burning rubber,7,comment,2,,,,
mu69t1w,2025-05-25 23:10:08,electricvehicles,t1_mu62r4q,_twentytwo_22,"Eh, tire wear isn't that much of an issue. I've got 84k miles and on my second set that are still going strong. Or does your username reveal your driving tendencies that might make that true (for you)?",11,comment,2,,,,
mu6b5p4,2025-05-25 23:17:17,electricvehicles,t1_mu62r4q,Emergency-Drawer-535,"IDK about tire wear. You can purchase a tire that emphasizes mileage over performance, no problem. My insurance in Thailand is first class and not any higher than similarly priced vehicles",5,comment,2,,,,
mu4819u,2025-05-25 12:40:47,electricvehicles,t1_mu47au8,ChickenFlavoredCake,"> Hertz was selling their entire rental fleet for prices that low

1. They were not barely used, neither in terms of KM or how they were taken care of. Rental cars are notoriously hard wear.
2. They were not 2023.",4,comment,2,,,,
mudnsfv,2025-05-27 02:55:19,electricvehicles,t1_muc6jz7,Brandon3541,"Honestly, it just sounds like you were driving a really old beater by your description....

For anything even vaguely new engine noise is negligible at highway speeds, jerky breaking means you just REALLY let the vehicle go maintenance-wise, and jerking also shouldn't happen during shifts. The last 2 in particular point to you not taking care of the car.

Lack of one pedal driving isn't a downside for most either, 1PD is a gimmick with no real benefit unless you are a more aggressive driver that doesn't break / coast very well. The commonly thought idea of it increasing range is false if you are already a decent driver, and that is unsurprising simply by virtue of physics and how the system works. It disables coasting (which is better than regen-braking in most scenarios), and it means you are performing more aggressive accelerate-decelerate cycles when not on cruise control as your foot naturally fluctuates positions. 1PD is really just a marketing ploy to make EVs feel special and futuristic.

Oh, don't get me wrong, EVs are on the road to being outright superior, you just listed reasons that DON'T matter.

Regen braking (not at all 1PD-only)  is nice as it reduces physical wear on the friction brakes, and ever so slightly increases range due to energy recovery.

The fact that its ""fuel"" is electricity means you have energy source independence, as electricity is electricity no matter how you make it, be it from coal, nuclear, hydro, solo or whatever, whereas a gas ICE can only take gas.

That previous point in particular means you can become 100% self-sufficient when it comes to powering your vehicle if you so desire.

EVs require less maintenance (which sounds like it is going to be a good thing for you judging from some of the issues you listed).

EVs have lower center of gravities due to their batteries, making them less rollover-prone

EVs have lower cost per mile with at home charging (more often than not, not true if using lv3 chargers though)

and probably some more I forgot off the top of my head.

EVs aren't PURELY superior yet though, because ICE (or EREVs by proxy) still reigns supreme when it comes to long distance trips and hauling heavy loads due to range, lack of planning needed to get from one place to the next, lack of the need to go out of your way to hit a gas pump on a trip, speed of filling up, amenities provided at gas stations, they suffer MUCH less during cold temperatures and at highway speeds, they have lower insurance rates, and they have much a greater number of service centers / much less wait time for repairs.

They will get there one day on most of these, but someone that wants to stay ICE for now can have very good reasons for doing so, heck, if I still travelled as much as I used to for work (multiple 10 hour trips per month, and many smaller multi-hour trips) I wouldn't have made the switch as it just wouldn't have made sense.",3,comment,2,,,,
mu3rf5x,2025-05-25 10:43:53,electricvehicles,t1_mu3nl81,ProfessionalSancho,"Dude, what are you doing on this sub lol. EVs already pay more in registration fees (my tabs, for instance, are $800.00/yr), which more than compensates for any wear they exert on the roads. A gas tax serves an entirely different purpose - it adds a cost per unit of CO2 emitted to incentivize the clean vehicle transition.

Now, I'm not saying these tax structures are perfect, but they are putting us on the right path.",5,comment,2,,,,
mu231nm,2025-05-25 04:33:57,electricvehicles,t1_mtptzfl,Drpantsgoblin,"Virginia does, based only on ""vehicle mpg"", even for ICE powered vehicles. My old Mercedes SLK is rated high enough I pay a fine on it every year. They didn't bother to think / care about the fact that a 3000-lb vehicle on sport tires wears the road less than a 9000+lb truck on knobby tires, hence why I should be paying less tax on total gas for highway repairs. 

And it's a flat fee. When I was back in school a few years ago, I put maybe 1000 miles / year on it, and at a fee of $26.91/yr (if it's rated at 30mpg, which I think it is) that comes out to $0.80/gal in fees based on the actual ~30mpg it gets. 

https://www.dmv.virginia.gov/sites/default/files/documents/2024-HUF-highway-use-fees.pdf",1,comment,2,,,,
mu1cksf,2025-05-25 02:10:06,electricvehicles,t1_mu1b6hj,takesthebiscuit,"Hahahaha good one 🤣🤣🤣🤣🤣

My ev isn’t also burning 60ltr of diesel in addition to the ‘tyre wear’ bullshit",1,comment,2,,,,
mtkrolo,2025-05-22 10:01:57,electricvehicles,t3_1ksddrn,sd140220,"Tire wear will also hurt the ev cost in a lot of cases, that and insurance.",-1,comment,2,,,,
mtomgoz,2025-05-23 01:51:58,electricvehicles,t1_mtnpnky,sd140220,"In general EV insurance has been more than the same cost of ICE vehicle from everything I have priced. Not a ton but ~$20-50 a month more. The increased weight will definitely wear tires faster on top of higher weight rating tires usually costing more to start with. a few extra cents a mile really adds up. I never said EV was more, but if you only count decreased fuel cost and not other increased costs you're not being totally fair.",1,comment,2,,,,
mtjcfxx,2025-05-22 05:27:51,electricvehicles,t3_1ks7udj,goldfish4free,"For less dense areas PHEVs are a great solution. A 50 mile EV range PHEV might have a 20 kWH battery and the engine runs 20% of annual miles. A comparably sized long range large BEV might require a 90 kWH battery and weigh about 500 lbs more. That's a lot less wear on roads, wear on tires, and damage caused in accidents. There's not going to be much net difference in resources and emissions. My PHEV gets an annual oil change and tire rotation. A BEV would have to get the tires rotated on the same schedule anyway...",9,comment,2,,,,
mt9cxwy,2025-05-20 16:35:37,electricvehicles,t1_mt7kajc,ned78,"There's a free short PDF called ""The little book of EV myths"" that was co-authored by an ex Top Gear presenter Quentin Wilson.  It's really good at dispelling all of the negative information like greenness, battery life expectancy, tire wear, fire risk, etc.  


https://drive.google.com/file/d/1STIzU4sLg7wBlPfjZ65jEEPTx3Uhk61E/view",3,comment,2,,,,
mt436gw,2025-05-19 21:46:58,electricvehicles,t3_1kpzzse,Aggressive_Ad_5454,"Unless **your car’s manual** says otherwise, don’t routinely charge to more than 80% of capacity unless you need to for travel. Batteries deteriorate faster when pushed all the way to 100% a lot. And, regenerative braking doesn’t work as well when the battery is near full.

Get a 12V tire pump with a gauge.  Watch your tire pressure, especially as seasons change.",1,comment,2,,,,
mt4h9mz,2025-05-19 23:08:57,electricvehicles,t3_1kpzzse,SteazGaming,"To add:

-Regenerative braking changes at nearly full charge state. Some EVs will fake it by mixing traditional braking. 

-you won’t need oil changes or most ICE maintenance but you will go through tires faster than traditional vehicles

-Depending on your State you may pay a bit more in registration renewal fees because they’re not getting gas tax from you, and you still need to contribute to paying for the roads",1,comment,2,,,,
mt42lji,2025-05-19 21:43:17,electricvehicles,t1_mt2etb0,MortimerDongle,"You don't need special tires. EV-specific tires are just marketing. 

They wear about the same as an ICE car of the same weight with the same tires, maybe a little less since EVs have better traction control. But yes, EVs are generally heavier than an ICE car of the same dimensions.",5,comment,2,,,,
mt2o167,2025-05-19 14:00:01,electricvehicles,t1_mt2etb0,Logitech4873,"You can use any tire with the correct weight rating. That's most tires. No special tires are required.


In driver's education you went over how tires work and what the markings on them mean, right? 


https://www.pirelli.com/tyres/en-gb/car/driving-and-tyre-tips/how-to-read/tyre-load-index",2,comment,2,,,,
mtzcqtj,2025-05-24 18:18:53,electricvehicles,t3_1kq9vx1,Laksu_ja_Molliamet,"I'm choosing between 2016 i3 94Ah with 95k km at 12k euros, 2017 Ioniq with 180k km at 13k euros and 2018 e-Golf with 62k km at 13k euros.

i3 - like the fact that it's RWD and fastest of the bunch, plastic/aluminium/carbon construction is a great bonus considering road salt (also the only affordable car with a carbon monocoque, how cool is that), but I'm not sure if it would serve well as my only car as driving that thing on the highway seems a bit sketchy to me. Also the tires are a weird size and some say they wear out fast.

Ioniq - best efficiency, fastest charging speed and tech of the bunch. Negative is I've heard some talk about reduction gear being flawed on those and getting one with 180k km which hasn't had a reduction oil change sounds iffy, also no app I believe?

e-Golf - haven't researched this one yet.

Any advice or more suggestions for alternatives?",1,comment,2,,,,
